{
  "$schema": "../schema/plugin.schema.json",
  "id": "vibeinging/dsh-agent-budget",
  "name": "dsh-agent-budget",
  "repository": "https://github.com/vibeinging/dsh-agent-budget",
  "category": "dev",
  "description": {
    "en": "Agent-tree token budget management.",
    "zh": "agent 树 token 预算管理。"
  },
  "added": "2026-08-13"
}
