{
  "$schema": "../schema/plugin.schema.json",
  "id": "omdsh-dev/dsh-gomoku",
  "name": "dsh-gomoku",
  "repository": "https://github.com/omdsh-dev/dsh-gomoku",
  "category": "fun",
  "description": {
    "en": "Play Gomoku against the AI, or let two AIs battle it out.",
    "zh": "与 AI 下五子棋，也可让 AI 对局比棋力。"
  },
  "added": "2026-08-13"
}
