{
  "$schema": "../schema/plugin.schema.json",
  "id": "Luke-Yong/dsh-plugin-knowledge-graph",
  "name": "dsh-plugin-knowledge-graph",
  "repository": "https://github.com/Luke-Yong/dsh-plugin-knowledge-graph",
  "category": "tools",
  "description": {
    "en": "A read_graph tool backed by a codebase knowledge graph (CONTAINS / EXPORTS / IMPORTS / IMPORTS_SYMBOL relations).",
    "zh": "基于代码库知识图谱的 read_graph 工具（CONTAINS / EXPORTS / IMPORTS / IMPORTS_SYMBOL 关系）。"
  },
  "added": "2026-08-14"
}
