{
  "$schema": "../schema/plugin.schema.json",
  "id": "vlln/whale-girl",
  "name": "whale-girl",
  "repository": "https://github.com/vlln/whale-girl",
  "category": "fun",
  "description": {
    "en": "Desktop pet (QQ-pet style): floats in the corner, draggable, feedable, playable.",
    "zh": "桌面宠物（QQ 宠物形态）：右下角悬浮、可拖拽/投喂/玩耍。"
  },
  "added": "2026-08-13"
}
